<?xml version="1.0" encoding="utf8"?>
<?xml-stylesheet type="text/xsl" href="../../xslt/fcs_html.xsl"?>
<!DOCTYPE character SYSTEM "character.dtd">
<character>
  <id>
    <charname nickname="Cisco">Francisco Ramon</charname>
    <playername>Proto-NPC</playername>
    <description>Kind of looks like Carlos Valdes</description>
  </id>
  <aspects>
    <aspect type="High-Concept">Awkward Nerd With a Lot of Potential</aspect>
    <aspect type="Trouble">Doesn't Put His Best Foot Forward</aspect>
    <aspect type="Call-To-Action">Particle Accelerator Explosion</aspect>
    <aspect type="War-Story">&#160;</aspect>
    <aspect gonzo="true" type="Team-Up">Team Flash's Vibe</aspect>
  </aspects>
  <skills>
    <role name="The&#160;Brain"> <!-- ShotC pg39 -->
      <skill name="Computers" add="0"/>
      <skill name="Gadgetry"  add="0"/>
      <skill name="Insight"   add="1"/>
      <skill name="Knowledge" add="0"/>
    </role>
    <role name="The&#160;Inventor"> <!-- ShotC pg40 -->
      <skill name="Awareness" add="2"/>
      <skill name="Contacts"  add="0"/>
      <skill name="Insight"   add="0"/>
      <skill name="Persuade"  add="0"/>
    </role>
    <role gonzo="true" name="Vibe"> <!-- ShotC pg42 -->
      <skill name="Contacts"  add="0"/>
      <skill name="Insight"   add="0"/>
      <skill name="Persuade"  add="0"/>
      <skill name="Provoke"   add="2"/>
    </role>
    <skill name="Shoot" add="3"/>
  </skills>
  <stunts>
    <stunt name=" ">&#160;</stunt>
    <stunt name=" ">&#160;</stunt>
  </stunts>
  <stress mental="4" physical="2"/>
  <consequences/>
  <hacks skill-roles="true"/>
  <notes>
 </notes>
</character>
